prompt_runs_by_dataset/us/2026-06-16__12-14-28__test-us/iteration_001/evaluation/analysis_summary.json

{
  "count": 10.0,
  "syntax_pass_rate": 1.0,
  "infrastructure_error_rate": 0.0,
  "node_precision": 0.4067039627039627,
  "node_recall": 0.3943043312092548,
  "node_f1": 0.4004081736300072,
  "relation_precision": 0.34139850076214057,
  "relation_recall": 0.3235907774099434,
  "relation_f1": 0.3322562029026346,
  "plantuml_compilation_pass_rate": 1.0,
  "llm_element_evaluated": 0.0,
  "llm_element_failed": 0.0,
  "llm_node_precision": 0.0,
  "llm_node_recall": 0.0,
  "llm_node_f1": 0.0,
  "llm_relation_precision": 0.0,
  "llm_relation_recall": 0.0,
  "llm_relation_f1": 0.0
}

prompt_runs_by_dataset/us/2026-06-16__12-14-28__test-us/iteration_001/evaluation/analysis_overview.md

## Summary

- count: 10
- syntax_pass_rate: 1.0000
- infrastructure_error_rate: 0.0000
- node_precision: 0.4067
- node_recall: 0.3943
- node_f1: 0.4004
- relation_precision: 0.3414
- relation_recall: 0.3236
- relation_f1: 0.3323
- plantuml_compilation_pass_rate: 1.0000
- llm_element_evaluated: 0.0000
- llm_element_failed: 0.0000
- llm_node_precision: 0.0000
- llm_node_recall: 0.0000
- llm_node_f1: 0.0000
- llm_relation_precision: 0.0000
- llm_relation_recall: 0.0000
- llm_relation_f1: 0.0000