prompt_runs_by_dataset/fsd/2026-06-13__02-55-25__test-fsd/iteration_003/evaluation_summary.json

{
  "count": 20.0,
  "syntax_pass_rate": 1.0,
  "infrastructure_error_rate": 0.0,
  "node_precision": 0.388558473736902,
  "node_recall": 0.390328034232869,
  "node_f1": 0.3774325960826063,
  "relation_precision": 0.23281585081585082,
  "relation_recall": 0.25225295129706893,
  "relation_f1": 0.22975189173345853,
  "plantuml_compilation_pass_rate": 1.0,
  "llm_element_evaluated": 0.0,
  "llm_element_failed": 0.0,
  "llm_node_precision": 0.0,
  "llm_node_recall": 0.0,
  "llm_node_f1": 0.0,
  "llm_relation_precision": 0.0,
  "llm_relation_recall": 0.0,
  "llm_relation_f1": 0.0
}

prompt_runs_by_dataset/fsd/2026-06-13__02-55-25__test-fsd/iteration_003/analysis/overview.md

## Summary

- count: 20
- syntax_pass_rate: 1.0000
- infrastructure_error_rate: 0.0000
- node_precision: 0.3886
- node_recall: 0.3903
- node_f1: 0.3774
- relation_precision: 0.2328
- relation_recall: 0.2523
- relation_f1: 0.2298
- plantuml_compilation_pass_rate: 1.0000
- llm_element_evaluated: 0.0000
- llm_element_failed: 0.0000
- llm_node_precision: 0.0000
- llm_node_recall: 0.0000
- llm_node_f1: 0.0000
- llm_relation_precision: 0.0000
- llm_relation_recall: 0.0000
- llm_relation_f1: 0.0000