prompt_runs_by_dataset/us/2026-06-16__11-08-11__test-us/iteration_002/evaluation/analysis_summary.json

{
  "count": 10.0,
  "syntax_pass_rate": 1.0,
  "infrastructure_error_rate": 0.0,
  "node_precision": 0.3841028854186749,
  "node_recall": 0.3638106639737074,
  "node_f1": 0.37368149271239365,
  "relation_precision": 0.3098606509070395,
  "relation_recall": 0.30311822388138177,
  "relation_f1": 0.30645235591875847,
  "plantuml_compilation_pass_rate": 1.0,
  "llm_element_evaluated": 0.0,
  "llm_element_failed": 0.0,
  "llm_node_precision": 0.0,
  "llm_node_recall": 0.0,
  "llm_node_f1": 0.0,
  "llm_relation_precision": 0.0,
  "llm_relation_recall": 0.0,
  "llm_relation_f1": 0.0
}

prompt_runs_by_dataset/us/2026-06-16__11-08-11__test-us/iteration_002/evaluation/analysis_overview.md

## Summary

- count: 10
- syntax_pass_rate: 1.0000
- infrastructure_error_rate: 0.0000
- node_precision: 0.3841
- node_recall: 0.3638
- node_f1: 0.3737
- relation_precision: 0.3099
- relation_recall: 0.3031
- relation_f1: 0.3065
- plantuml_compilation_pass_rate: 1.0000
- llm_element_evaluated: 0.0000
- llm_element_failed: 0.0000
- llm_node_precision: 0.0000
- llm_node_recall: 0.0000
- llm_node_f1: 0.0000
- llm_relation_precision: 0.0000
- llm_relation_recall: 0.0000
- llm_relation_f1: 0.0000