prompt_runs_by_dataset/us/2026-06-16__12-36-41__test-us/iteration_003/evaluation/analysis_summary.json

{
  "count": 10.0,
  "syntax_pass_rate": 1.0,
  "infrastructure_error_rate": 0.0,
  "node_precision": 0.5532984423492148,
  "node_recall": 0.5442903920248312,
  "node_f1": 0.5487574520831037,
  "relation_precision": 0.3702174633294178,
  "relation_recall": 0.353538165368829,
  "relation_f1": 0.3616856231112062,
  "plantuml_compilation_pass_rate": 1.0,
  "llm_element_evaluated": 0.0,
  "llm_element_failed": 0.0,
  "llm_node_precision": 0.0,
  "llm_node_recall": 0.0,
  "llm_node_f1": 0.0,
  "llm_relation_precision": 0.0,
  "llm_relation_recall": 0.0,
  "llm_relation_f1": 0.0
}

prompt_runs_by_dataset/us/2026-06-16__12-36-41__test-us/iteration_003/evaluation/analysis_overview.md

## Summary

- count: 10
- syntax_pass_rate: 1.0000
- infrastructure_error_rate: 0.0000
- node_precision: 0.5533
- node_recall: 0.5443
- node_f1: 0.5488
- relation_precision: 0.3702
- relation_recall: 0.3535
- relation_f1: 0.3617
- plantuml_compilation_pass_rate: 1.0000
- llm_element_evaluated: 0.0000
- llm_element_failed: 0.0000
- llm_node_precision: 0.0000
- llm_node_recall: 0.0000
- llm_node_f1: 0.0000
- llm_relation_precision: 0.0000
- llm_relation_recall: 0.0000
- llm_relation_f1: 0.0000