prompt_runs_by_dataset/fsd/2026-06-13__01-43-02__test-fsd/iteration_003/evaluation_summary.json

{
  "count": 10.0,
  "syntax_pass_rate": 1.0,
  "infrastructure_error_rate": 0.0,
  "node_precision": 0.3215666725747371,
  "node_recall": 0.313875046142488,
  "node_f1": 0.3046479366044583,
  "relation_precision": 0.2188482085290596,
  "relation_recall": 0.2527435309788251,
  "relation_f1": 0.2243523645682132,
  "plantuml_compilation_pass_rate": 1.0,
  "llm_element_evaluated": 0.0,
  "llm_element_failed": 0.0,
  "llm_node_precision": 0.0,
  "llm_node_recall": 0.0,
  "llm_node_f1": 0.0,
  "llm_relation_precision": 0.0,
  "llm_relation_recall": 0.0,
  "llm_relation_f1": 0.0
}

prompt_runs_by_dataset/fsd/2026-06-13__01-43-02__test-fsd/iteration_003/analysis/overview.md

## Summary

- count: 10
- syntax_pass_rate: 1.0000
- infrastructure_error_rate: 0.0000
- node_precision: 0.3216
- node_recall: 0.3139
- node_f1: 0.3046
- relation_precision: 0.2188
- relation_recall: 0.2527
- relation_f1: 0.2244
- plantuml_compilation_pass_rate: 1.0000
- llm_element_evaluated: 0.0000
- llm_element_failed: 0.0000
- llm_node_precision: 0.0000
- llm_node_recall: 0.0000
- llm_node_f1: 0.0000
- llm_relation_precision: 0.0000
- llm_relation_recall: 0.0000
- llm_relation_f1: 0.0000