prompt_runs_by_dataset/fsd/2026-06-18__23-12-33__test-fsd/iteration_009/evaluation/analysis_summary.json

{
  "count": 20.0,
  "syntax_pass_rate": 0.95,
  "infrastructure_error_rate": 0.0,
  "node_precision": 0.4643930787938225,
  "node_recall": 0.43358002377739224,
  "node_f1": 0.44845789159818084,
  "relation_precision": 0.3975064073435016,
  "relation_recall": 0.3906286671947427,
  "relation_f1": 0.39403752762288136,
  "plantuml_compilation_pass_rate": 0.95,
  "llm_element_evaluated": 20.0,
  "llm_element_failed": 0.0,
  "llm_node_precision": 0.8648199999999999,
  "llm_node_recall": 0.8214349999999999,
  "llm_node_f1": 0.82818,
  "llm_relation_precision": 0.5987,
  "llm_relation_recall": 0.561715,
  "llm_relation_f1": 0.553195
}

prompt_runs_by_dataset/fsd/2026-06-18__23-12-33__test-fsd/iteration_009/evaluation/analysis_overview.md

## Summary

- count: 20
- syntax_pass_rate: 0.9500
- infrastructure_error_rate: 0.0000
- node_precision: 0.4644
- node_recall: 0.4336
- node_f1: 0.4485
- relation_precision: 0.3975
- relation_recall: 0.3906
- relation_f1: 0.3940
- plantuml_compilation_pass_rate: 0.9500
- llm_element_evaluated: 20.0000
- llm_element_failed: 0.0000
- llm_node_precision: 0.8648
- llm_node_recall: 0.8214
- llm_node_f1: 0.8282
- llm_relation_precision: 0.5987
- llm_relation_recall: 0.5617
- llm_relation_f1: 0.5532