prompt_runs_by_dataset/us/2026-06-16__12-36-41__test-us/iteration_005/evaluation/analysis_summary.json

{
  "count": 10.0,
  "syntax_pass_rate": 1.0,
  "infrastructure_error_rate": 0.0,
  "node_precision": 0.40171482026745187,
  "node_recall": 0.3835228888758301,
  "node_f1": 0.3924081245188787,
  "relation_precision": 0.3213556474354529,
  "relation_recall": 0.33870096436744035,
  "relation_f1": 0.32980040119290255,
  "plantuml_compilation_pass_rate": 1.0,
  "llm_element_evaluated": 0.0,
  "llm_element_failed": 0.0,
  "llm_node_precision": 0.0,
  "llm_node_recall": 0.0,
  "llm_node_f1": 0.0,
  "llm_relation_precision": 0.0,
  "llm_relation_recall": 0.0,
  "llm_relation_f1": 0.0
}

prompt_runs_by_dataset/us/2026-06-16__12-36-41__test-us/iteration_005/evaluation/analysis_overview.md

## Summary

- count: 10
- syntax_pass_rate: 1.0000
- infrastructure_error_rate: 0.0000
- node_precision: 0.4017
- node_recall: 0.3835
- node_f1: 0.3924
- relation_precision: 0.3214
- relation_recall: 0.3387
- relation_f1: 0.3298
- plantuml_compilation_pass_rate: 1.0000
- llm_element_evaluated: 0.0000
- llm_element_failed: 0.0000
- llm_node_precision: 0.0000
- llm_node_recall: 0.0000
- llm_node_f1: 0.0000
- llm_relation_precision: 0.0000
- llm_relation_recall: 0.0000
- llm_relation_f1: 0.0000