prompt_runs_by_dataset/fsd/2026-06-12__20-25-46__test-fsd/iteration_002/train_summary.json

{
  "count": 10.0,
  "syntax_pass_rate": 1.0,
  "infrastructure_error_rate": 0.0,
  "node_precision": 0.2268449108778944,
  "node_recall": 0.21364066193853426,
  "node_f1": 0.2182522032643761,
  "relation_precision": 0.16548552754435106,
  "relation_recall": 0.16230572496557152,
  "relation_f1": 0.16338432809021045,
  "plantuml_compilation_pass_rate": 1.0,
  "llm_element_evaluated": 0.0,
  "llm_element_failed": 0.0,
  "llm_node_precision": 0.0,
  "llm_node_recall": 0.0,
  "llm_node_f1": 0.0,
  "llm_relation_precision": 0.0,
  "llm_relation_recall": 0.0,
  "llm_relation_f1": 0.0
}

prompt_runs_by_dataset/fsd/2026-06-12__20-25-46__test-fsd/iteration_002/analysis/overview.md

## Summary

- count: 10
- syntax_pass_rate: 1.0000
- infrastructure_error_rate: 0.0000
- node_precision: 0.2268
- node_recall: 0.2136
- node_f1: 0.2183
- relation_precision: 0.1655
- relation_recall: 0.1623
- relation_f1: 0.1634
- plantuml_compilation_pass_rate: 1.0000
- llm_element_evaluated: 0.0000
- llm_element_failed: 0.0000
- llm_node_precision: 0.0000
- llm_node_recall: 0.0000
- llm_node_f1: 0.0000
- llm_relation_precision: 0.0000
- llm_relation_recall: 0.0000
- llm_relation_f1: 0.0000