prompt_runs_by_dataset/fsd/2026-06-17__19-20-36__test-fsd/iteration_001/evaluation/analysis_summary.json

{
  "count": 5.0,
  "syntax_pass_rate": 1.0,
  "infrastructure_error_rate": 0.0,
  "node_precision": 0.38045584045584047,
  "node_recall": 0.36234432234432234,
  "node_f1": 0.37117927700023634,
  "relation_precision": 0.2577489177489177,
  "relation_recall": 0.2782051282051282,
  "relation_f1": 0.2675866382515155,
  "plantuml_compilation_pass_rate": 1.0,
  "llm_element_evaluated": 5.0,
  "llm_element_failed": 0.0,
  "llm_node_precision": 0.7510600000000001,
  "llm_node_recall": 0.91286,
  "llm_node_f1": 0.79,
  "llm_relation_precision": 0.55728,
  "llm_relation_recall": 0.61076,
  "llm_relation_f1": 0.52114
}

prompt_runs_by_dataset/fsd/2026-06-17__19-20-36__test-fsd/iteration_001/evaluation/analysis_overview.md

## Summary

- count: 5
- syntax_pass_rate: 1.0000
- infrastructure_error_rate: 0.0000
- node_precision: 0.3805
- node_recall: 0.3623
- node_f1: 0.3712
- relation_precision: 0.2577
- relation_recall: 0.2782
- relation_f1: 0.2676
- plantuml_compilation_pass_rate: 1.0000
- llm_element_evaluated: 5.0000
- llm_element_failed: 0.0000
- llm_node_precision: 0.7511
- llm_node_recall: 0.9129
- llm_node_f1: 0.7900
- llm_relation_precision: 0.5573
- llm_relation_recall: 0.6108
- llm_relation_f1: 0.5211