prompt_runs_by_dataset/fsd/2026-06-13__17-50-37__test-fsd/iteration_001/evaluation_summary.json

{
  "count": 10.0,
  "syntax_pass_rate": 1.0,
  "infrastructure_error_rate": 0.0,
  "node_precision": 0.1867948717948718,
  "node_recall": 0.17461180124223602,
  "node_f1": 0.16457392457392456,
  "relation_precision": 0.08931159420289855,
  "relation_recall": 0.09525691699604744,
  "relation_f1": 0.09135634840387115,
  "plantuml_compilation_pass_rate": 1.0,
  "llm_element_evaluated": 0.0,
  "llm_element_failed": 0.0,
  "llm_node_precision": 0.0,
  "llm_node_recall": 0.0,
  "llm_node_f1": 0.0,
  "llm_relation_precision": 0.0,
  "llm_relation_recall": 0.0,
  "llm_relation_f1": 0.0
}

prompt_runs_by_dataset/fsd/2026-06-13__17-50-37__test-fsd/iteration_001/analysis/overview.md

## Summary

- count: 10
- syntax_pass_rate: 1.0000
- infrastructure_error_rate: 0.0000
- node_precision: 0.1868
- node_recall: 0.1746
- node_f1: 0.1646
- relation_precision: 0.0893
- relation_recall: 0.0953
- relation_f1: 0.0914
- plantuml_compilation_pass_rate: 1.0000
- llm_element_evaluated: 0.0000
- llm_element_failed: 0.0000
- llm_node_precision: 0.0000
- llm_node_recall: 0.0000
- llm_node_f1: 0.0000
- llm_relation_precision: 0.0000
- llm_relation_recall: 0.0000
- llm_relation_f1: 0.0000