prompt_runs_by_dataset/fsd/2026-06-18__11-21-05__test-fsd/iteration_008/evaluation/analysis_summary.json

{
  "count": 20.0,
  "syntax_pass_rate": 1.0,
  "infrastructure_error_rate": 0.0,
  "node_precision": 0.48525637033469515,
  "node_recall": 0.46950227567410235,
  "node_f1": 0.4772493469630125,
  "relation_precision": 0.3960270682204044,
  "relation_recall": 0.3410162188642521,
  "relation_f1": 0.36646871558008115,
  "plantuml_compilation_pass_rate": 1.0,
  "llm_element_evaluated": 20.0,
  "llm_element_failed": 0.0,
  "llm_node_precision": 0.8739699999999999,
  "llm_node_recall": 0.7873300000000001,
  "llm_node_f1": 0.8196199999999999,
  "llm_relation_precision": 0.632915,
  "llm_relation_recall": 0.524505,
  "llm_relation_f1": 0.558535
}

prompt_runs_by_dataset/fsd/2026-06-18__11-21-05__test-fsd/iteration_008/evaluation/analysis_overview.md

## Summary

- count: 20
- syntax_pass_rate: 1.0000
- infrastructure_error_rate: 0.0000
- node_precision: 0.4853
- node_recall: 0.4695
- node_f1: 0.4772
- relation_precision: 0.3960
- relation_recall: 0.3410
- relation_f1: 0.3665
- plantuml_compilation_pass_rate: 1.0000
- llm_element_evaluated: 20.0000
- llm_element_failed: 0.0000
- llm_node_precision: 0.8740
- llm_node_recall: 0.7873
- llm_node_f1: 0.8196
- llm_relation_precision: 0.6329
- llm_relation_recall: 0.5245
- llm_relation_f1: 0.5585