prompt_runs_by_dataset/us/2026-06-16__18-31-48__test-us/iteration_001/evaluation/analysis_summary.json

{
  "count": 4.0,
  "syntax_pass_rate": 1.0,
  "infrastructure_error_rate": 0.0,
  "node_precision": 0.48686868686868684,
  "node_recall": 0.5379310344827586,
  "node_f1": 0.5111277275508123,
  "relation_precision": 0.37165032679738563,
  "relation_recall": 0.39363143631436315,
  "relation_f1": 0.3823252009798518,
  "plantuml_compilation_pass_rate": 1.0,
  "llm_element_evaluated": 0.0,
  "llm_element_failed": 0.0,
  "llm_node_precision": 0.0,
  "llm_node_recall": 0.0,
  "llm_node_f1": 0.0,
  "llm_relation_precision": 0.0,
  "llm_relation_recall": 0.0,
  "llm_relation_f1": 0.0
}

prompt_runs_by_dataset/us/2026-06-16__18-31-48__test-us/iteration_001/evaluation/analysis_overview.md

## Summary

- count: 4
- syntax_pass_rate: 1.0000
- infrastructure_error_rate: 0.0000
- node_precision: 0.4869
- node_recall: 0.5379
- node_f1: 0.5111
- relation_precision: 0.3717
- relation_recall: 0.3936
- relation_f1: 0.3823
- plantuml_compilation_pass_rate: 1.0000
- llm_element_evaluated: 0.0000
- llm_element_failed: 0.0000
- llm_node_precision: 0.0000
- llm_node_recall: 0.0000
- llm_node_f1: 0.0000
- llm_relation_precision: 0.0000
- llm_relation_recall: 0.0000
- llm_relation_f1: 0.0000