prompt_runs_by_dataset/us/2026-06-16__12-36-41__test-us/iteration_004/evaluation/analysis_summary.json

{
  "count": 10.0,
  "syntax_pass_rate": 1.0,
  "infrastructure_error_rate": 0.0,
  "node_precision": 0.6567672654143243,
  "node_recall": 0.6110670515627412,
  "node_f1": 0.6330935060924293,
  "relation_precision": 0.4652842869690696,
  "relation_recall": 0.4702276298008005,
  "relation_f1": 0.4677428978146131,
  "plantuml_compilation_pass_rate": 1.0,
  "llm_element_evaluated": 0.0,
  "llm_element_failed": 0.0,
  "llm_node_precision": 0.0,
  "llm_node_recall": 0.0,
  "llm_node_f1": 0.0,
  "llm_relation_precision": 0.0,
  "llm_relation_recall": 0.0,
  "llm_relation_f1": 0.0
}

prompt_runs_by_dataset/us/2026-06-16__12-36-41__test-us/iteration_004/evaluation/analysis_overview.md

## Summary

- count: 10
- syntax_pass_rate: 1.0000
- infrastructure_error_rate: 0.0000
- node_precision: 0.6568
- node_recall: 0.6111
- node_f1: 0.6331
- relation_precision: 0.4653
- relation_recall: 0.4702
- relation_f1: 0.4677
- plantuml_compilation_pass_rate: 1.0000
- llm_element_evaluated: 0.0000
- llm_element_failed: 0.0000
- llm_node_precision: 0.0000
- llm_node_recall: 0.0000
- llm_node_f1: 0.0000
- llm_relation_precision: 0.0000
- llm_relation_recall: 0.0000
- llm_relation_f1: 0.0000