prompt_runs_by_dataset/us/2026-06-16__17-59-14__test-us/iteration_002/evaluation/analysis_summary.json

{
  "count": 4.0,
  "syntax_pass_rate": 0.75,
  "infrastructure_error_rate": 0.0,
  "node_precision": 0.36605182257356167,
  "node_recall": 0.2643625192012289,
  "node_f1": 0.30700564870181307,
  "relation_precision": 0.529491341991342,
  "relation_recall": 0.3141025641025641,
  "relation_f1": 0.3943001175996513,
  "plantuml_compilation_pass_rate": 0.75,
  "llm_element_evaluated": 0.0,
  "llm_element_failed": 0.0,
  "llm_node_precision": 0.0,
  "llm_node_recall": 0.0,
  "llm_node_f1": 0.0,
  "llm_relation_precision": 0.0,
  "llm_relation_recall": 0.0,
  "llm_relation_f1": 0.0
}

prompt_runs_by_dataset/us/2026-06-16__17-59-14__test-us/iteration_002/evaluation/analysis_overview.md

## Summary

- count: 4
- syntax_pass_rate: 0.7500
- infrastructure_error_rate: 0.0000
- node_precision: 0.3661
- node_recall: 0.2644
- node_f1: 0.3070
- relation_precision: 0.5295
- relation_recall: 0.3141
- relation_f1: 0.3943
- plantuml_compilation_pass_rate: 0.7500
- llm_element_evaluated: 0.0000
- llm_element_failed: 0.0000
- llm_node_precision: 0.0000
- llm_node_recall: 0.0000
- llm_node_f1: 0.0000
- llm_relation_precision: 0.0000
- llm_relation_recall: 0.0000
- llm_relation_f1: 0.0000