prompt_runs_by_dataset/us/2026-06-16__12-14-28__test-us/iteration_002/evaluation/analysis_summary.json

{
  "count": 10.0,
  "syntax_pass_rate": 0.8,
  "infrastructure_error_rate": 0.0,
  "node_precision": 0.4485489993098689,
  "node_recall": 0.40414037049906615,
  "node_f1": 0.42518826946017885,
  "relation_precision": 0.3306918498168498,
  "relation_recall": 0.2792818102949682,
  "relation_f1": 0.3028203494875866,
  "plantuml_compilation_pass_rate": 0.8,
  "llm_element_evaluated": 0.0,
  "llm_element_failed": 0.0,
  "llm_node_precision": 0.0,
  "llm_node_recall": 0.0,
  "llm_node_f1": 0.0,
  "llm_relation_precision": 0.0,
  "llm_relation_recall": 0.0,
  "llm_relation_f1": 0.0
}

prompt_runs_by_dataset/us/2026-06-16__12-14-28__test-us/iteration_002/evaluation/analysis_overview.md

## Summary

- count: 10
- syntax_pass_rate: 0.8000
- infrastructure_error_rate: 0.0000
- node_precision: 0.4485
- node_recall: 0.4041
- node_f1: 0.4252
- relation_precision: 0.3307
- relation_recall: 0.2793
- relation_f1: 0.3028
- plantuml_compilation_pass_rate: 0.8000
- llm_element_evaluated: 0.0000
- llm_element_failed: 0.0000
- llm_node_precision: 0.0000
- llm_node_recall: 0.0000
- llm_node_f1: 0.0000
- llm_relation_precision: 0.0000
- llm_relation_recall: 0.0000
- llm_relation_f1: 0.0000