prompt_runs_by_dataset/fsd/2026-06-18__11-21-05__test-fsd/iteration_007/evaluation/analysis_summary.json

{
  "count": 20.0,
  "syntax_pass_rate": 0.95,
  "infrastructure_error_rate": 0.0,
  "node_precision": 0.5702929672666515,
  "node_recall": 0.6291217954433057,
  "node_f1": 0.5982646648184492,
  "relation_precision": 0.4686878306878307,
  "relation_recall": 0.4325883619304672,
  "relation_f1": 0.4499151372122388,
  "plantuml_compilation_pass_rate": 0.95,
  "llm_element_evaluated": 20.0,
  "llm_element_failed": 0.0,
  "llm_node_precision": 0.78678,
  "llm_node_recall": 0.8535299999999999,
  "llm_node_f1": 0.79565,
  "llm_relation_precision": 0.5826749999999999,
  "llm_relation_recall": 0.6227050000000001,
  "llm_relation_f1": 0.56655
}

prompt_runs_by_dataset/fsd/2026-06-18__11-21-05__test-fsd/iteration_007/evaluation/analysis_overview.md

## Summary

- count: 20
- syntax_pass_rate: 0.9500
- infrastructure_error_rate: 0.0000
- node_precision: 0.5703
- node_recall: 0.6291
- node_f1: 0.5983
- relation_precision: 0.4687
- relation_recall: 0.4326
- relation_f1: 0.4499
- plantuml_compilation_pass_rate: 0.9500
- llm_element_evaluated: 20.0000
- llm_element_failed: 0.0000
- llm_node_precision: 0.7868
- llm_node_recall: 0.8535
- llm_node_f1: 0.7956
- llm_relation_precision: 0.5827
- llm_relation_recall: 0.6227
- llm_relation_f1: 0.5665