prompt_runs_by_dataset/us/2026-06-16__12-36-41__test-us/iteration_010/evaluation/analysis_summary.json

{
  "count": 10.0,
  "syntax_pass_rate": 0.9,
  "infrastructure_error_rate": 0.0,
  "node_precision": 0.6338049450549451,
  "node_recall": 0.49212847075169586,
  "node_f1": 0.554053115372354,
  "relation_precision": 0.5211255411255411,
  "relation_recall": 0.46447712613473485,
  "relation_f1": 0.4911733738916102,
  "plantuml_compilation_pass_rate": 0.9,
  "llm_element_evaluated": 0.0,
  "llm_element_failed": 0.0,
  "llm_node_precision": 0.0,
  "llm_node_recall": 0.0,
  "llm_node_f1": 0.0,
  "llm_relation_precision": 0.0,
  "llm_relation_recall": 0.0,
  "llm_relation_f1": 0.0
}

prompt_runs_by_dataset/us/2026-06-16__12-36-41__test-us/iteration_010/evaluation/analysis_overview.md

## Summary

- count: 10
- syntax_pass_rate: 0.9000
- infrastructure_error_rate: 0.0000
- node_precision: 0.6338
- node_recall: 0.4921
- node_f1: 0.5541
- relation_precision: 0.5211
- relation_recall: 0.4645
- relation_f1: 0.4912
- plantuml_compilation_pass_rate: 0.9000
- llm_element_evaluated: 0.0000
- llm_element_failed: 0.0000
- llm_node_precision: 0.0000
- llm_node_recall: 0.0000
- llm_node_f1: 0.0000
- llm_relation_precision: 0.0000
- llm_relation_recall: 0.0000
- llm_relation_f1: 0.0000