prompt_runs_by_dataset/us/2026-06-16__12-36-41__test-us/iteration_007/evaluation/analysis_summary.json

{
  "count": 10.0,
  "syntax_pass_rate": 0.9,
  "infrastructure_error_rate": 0.0,
  "node_precision": 0.5205084541062802,
  "node_recall": 0.489705073721092,
  "node_f1": 0.5046371363463364,
  "relation_precision": 0.5079520528394277,
  "relation_recall": 0.4646733462615815,
  "relation_f1": 0.48534981782605935,
  "plantuml_compilation_pass_rate": 0.9,
  "llm_element_evaluated": 0.0,
  "llm_element_failed": 0.0,
  "llm_node_precision": 0.0,
  "llm_node_recall": 0.0,
  "llm_node_f1": 0.0,
  "llm_relation_precision": 0.0,
  "llm_relation_recall": 0.0,
  "llm_relation_f1": 0.0
}

prompt_runs_by_dataset/us/2026-06-16__12-36-41__test-us/iteration_007/evaluation/analysis_overview.md

## Summary

- count: 10
- syntax_pass_rate: 0.9000
- infrastructure_error_rate: 0.0000
- node_precision: 0.5205
- node_recall: 0.4897
- node_f1: 0.5046
- relation_precision: 0.5080
- relation_recall: 0.4647
- relation_f1: 0.4853
- plantuml_compilation_pass_rate: 0.9000
- llm_element_evaluated: 0.0000
- llm_element_failed: 0.0000
- llm_node_precision: 0.0000
- llm_node_recall: 0.0000
- llm_node_f1: 0.0000
- llm_relation_precision: 0.0000
- llm_relation_recall: 0.0000
- llm_relation_f1: 0.0000