prompt_runs_by_dataset/us/2026-06-12__22-09-19__test-us/test_summary.json

{
  "count": 220.0,
  "syntax_pass_rate": 0.9318181818181818,
  "infrastructure_error_rate": 0.0,
  "node_precision": 0.036216855181368135,
  "node_recall": 0.14242424242424243,
  "node_f1": 0.05371151946686706,
  "relation_precision": 0.004930360043996408,
  "relation_recall": 0.01818181818181818,
  "relation_f1": 0.0067878459923914475,
  "plantuml_compilation_pass_rate": 0.9318181818181818,
  "llm_element_evaluated": 0.0,
  "llm_element_failed": 0.0,
  "llm_node_precision": 0.0,
  "llm_node_recall": 0.0,
  "llm_node_f1": 0.0,
  "llm_relation_precision": 0.0,
  "llm_relation_recall": 0.0,
  "llm_relation_f1": 0.0
}

prompt_runs_by_dataset/us/2026-06-12__22-09-19__test-us/test_analysis.md

## Summary

- count: 220
- syntax_pass_rate: 0.9318
- infrastructure_error_rate: 0.0000
- node_precision: 0.0362
- node_recall: 0.1424
- node_f1: 0.0537
- relation_precision: 0.0049
- relation_recall: 0.0182
- relation_f1: 0.0068
- plantuml_compilation_pass_rate: 0.9318
- llm_element_evaluated: 0.0000
- llm_element_failed: 0.0000
- llm_node_precision: 0.0000
- llm_node_recall: 0.0000
- llm_node_f1: 0.0000
- llm_relation_precision: 0.0000
- llm_relation_recall: 0.0000
- llm_relation_f1: 0.0000