prompt_runs_by_dataset/fsd/2026-06-17__20-01-43__test-fsd/iteration_002/evaluation/analysis_summary.json

{
  "count": 10.0,
  "syntax_pass_rate": 0.9,
  "infrastructure_error_rate": 0.0,
  "node_precision": 0.54429844432052,
  "node_recall": 0.5070454545454546,
  "node_f1": 0.5250119440585908,
  "relation_precision": 0.5177200577200577,
  "relation_recall": 0.4979985736699472,
  "relation_f1": 0.507667856701774,
  "plantuml_compilation_pass_rate": 0.9,
  "llm_element_evaluated": 10.0,
  "llm_element_failed": 0.0,
  "llm_node_precision": 0.80693,
  "llm_node_recall": 0.7848200000000001,
  "llm_node_f1": 0.7845799999999999,
  "llm_relation_precision": 0.63175,
  "llm_relation_recall": 0.6165,
  "llm_relation_f1": 0.60494
}

prompt_runs_by_dataset/fsd/2026-06-17__20-01-43__test-fsd/iteration_002/evaluation/analysis_overview.md

## Summary

- count: 10
- syntax_pass_rate: 0.9000
- infrastructure_error_rate: 0.0000
- node_precision: 0.5443
- node_recall: 0.5070
- node_f1: 0.5250
- relation_precision: 0.5177
- relation_recall: 0.4980
- relation_f1: 0.5077
- plantuml_compilation_pass_rate: 0.9000
- llm_element_evaluated: 10.0000
- llm_element_failed: 0.0000
- llm_node_precision: 0.8069
- llm_node_recall: 0.7848
- llm_node_f1: 0.7846
- llm_relation_precision: 0.6318
- llm_relation_recall: 0.6165
- llm_relation_f1: 0.6049