prompt_runs_by_dataset/fsd/2026-06-13__02-55-25__test-fsd/iteration_002/train_summary.json

{
  "count": 20.0,
  "syntax_pass_rate": 0.85,
  "infrastructure_error_rate": 0.0,
  "node_precision": 0.45330124223602486,
  "node_recall": 0.4250796895590387,
  "node_f1": 0.43073153571025624,
  "relation_precision": 0.32867999096657635,
  "relation_recall": 0.33580697631953255,
  "relation_f1": 0.3310759036560923,
  "plantuml_compilation_pass_rate": 0.85,
  "llm_element_evaluated": 0.0,
  "llm_element_failed": 0.0,
  "llm_node_precision": 0.0,
  "llm_node_recall": 0.0,
  "llm_node_f1": 0.0,
  "llm_relation_precision": 0.0,
  "llm_relation_recall": 0.0,
  "llm_relation_f1": 0.0
}

prompt_runs_by_dataset/fsd/2026-06-13__02-55-25__test-fsd/iteration_002/analysis/overview.md

## Summary

- count: 20
- syntax_pass_rate: 0.8500
- infrastructure_error_rate: 0.0000
- node_precision: 0.4533
- node_recall: 0.4251
- node_f1: 0.4307
- relation_precision: 0.3287
- relation_recall: 0.3358
- relation_f1: 0.3311
- plantuml_compilation_pass_rate: 0.8500
- llm_element_evaluated: 0.0000
- llm_element_failed: 0.0000
- llm_node_precision: 0.0000
- llm_node_recall: 0.0000
- llm_node_f1: 0.0000
- llm_relation_precision: 0.0000
- llm_relation_recall: 0.0000
- llm_relation_f1: 0.0000