prompt_runs_by_dataset/fsd/2026-06-14__23-04-41__test-fsd/iteration_001/evaluation/analysis_summary.json

{
  "count": 20.0,
  "syntax_pass_rate": 0.95,
  "infrastructure_error_rate": 0.0,
  "node_precision": 0.23481564488143433,
  "node_recall": 0.2760319616977226,
  "node_f1": 0.2537610914064041,
  "relation_precision": 0.23507964648309917,
  "relation_recall": 0.2296825555349474,
  "relation_f1": 0.23234976391816678,
  "plantuml_compilation_pass_rate": 0.95,
  "llm_element_evaluated": 20.0,
  "llm_element_failed": 0.0,
  "llm_node_precision": 0.7264700000000001,
  "llm_node_recall": 0.82818,
  "llm_node_f1": 0.7178150000000001,
  "llm_relation_precision": 0.5811200000000001,
  "llm_relation_recall": 0.6511199999999999,
  "llm_relation_f1": 0.5364099999999999
}

prompt_runs_by_dataset/fsd/2026-06-14__23-04-41__test-fsd/iteration_001/evaluation/analysis_overview.md

## Summary

- count: 20
- syntax_pass_rate: 0.9500
- infrastructure_error_rate: 0.0000
- node_precision: 0.2348
- node_recall: 0.2760
- node_f1: 0.2538
- relation_precision: 0.2351
- relation_recall: 0.2297
- relation_f1: 0.2323
- plantuml_compilation_pass_rate: 0.9500
- llm_element_evaluated: 20.0000
- llm_element_failed: 0.0000
- llm_node_precision: 0.7265
- llm_node_recall: 0.8282
- llm_node_f1: 0.7178
- llm_relation_precision: 0.5811
- llm_relation_recall: 0.6511
- llm_relation_f1: 0.5364