prompt_runs_by_dataset/us/2026-06-16__11-08-11__test-us/iteration_003/evaluation/analysis_summary.json

{
  "count": 10.0,
  "syntax_pass_rate": 1.0,
  "infrastructure_error_rate": 0.0,
  "node_precision": 0.35268157768157765,
  "node_recall": 0.33991889977556417,
  "node_f1": 0.3461826486079788,
  "relation_precision": 0.28070520876972493,
  "relation_recall": 0.22663510783648083,
  "relation_f1": 0.25078888145673656,
  "plantuml_compilation_pass_rate": 1.0,
  "llm_element_evaluated": 0.0,
  "llm_element_failed": 0.0,
  "llm_node_precision": 0.0,
  "llm_node_recall": 0.0,
  "llm_node_f1": 0.0,
  "llm_relation_precision": 0.0,
  "llm_relation_recall": 0.0,
  "llm_relation_f1": 0.0
}

prompt_runs_by_dataset/us/2026-06-16__11-08-11__test-us/iteration_003/evaluation/analysis_overview.md

## Summary

- count: 10
- syntax_pass_rate: 1.0000
- infrastructure_error_rate: 0.0000
- node_precision: 0.3527
- node_recall: 0.3399
- node_f1: 0.3462
- relation_precision: 0.2807
- relation_recall: 0.2266
- relation_f1: 0.2508
- plantuml_compilation_pass_rate: 1.0000
- llm_element_evaluated: 0.0000
- llm_element_failed: 0.0000
- llm_node_precision: 0.0000
- llm_node_recall: 0.0000
- llm_node_f1: 0.0000
- llm_relation_precision: 0.0000
- llm_relation_recall: 0.0000
- llm_relation_f1: 0.0000