prompt_runs_by_dataset/us/2026-06-16__12-36-41__test-us/iteration_001/evaluation/analysis_summary.json

{
  "count": 10.0,
  "syntax_pass_rate": 0.9,
  "infrastructure_error_rate": 0.0,
  "node_precision": 0.45680107181922064,
  "node_recall": 0.4483540449363879,
  "node_f1": 0.4525381439935521,
  "relation_precision": 0.4224858864332549,
  "relation_recall": 0.43705231587148186,
  "relation_f1": 0.4296456739061972,
  "plantuml_compilation_pass_rate": 0.9,
  "llm_element_evaluated": 0.0,
  "llm_element_failed": 0.0,
  "llm_node_precision": 0.0,
  "llm_node_recall": 0.0,
  "llm_node_f1": 0.0,
  "llm_relation_precision": 0.0,
  "llm_relation_recall": 0.0,
  "llm_relation_f1": 0.0
}

prompt_runs_by_dataset/us/2026-06-16__12-36-41__test-us/iteration_001/evaluation/analysis_overview.md

## Summary

- count: 10
- syntax_pass_rate: 0.9000
- infrastructure_error_rate: 0.0000
- node_precision: 0.4568
- node_recall: 0.4484
- node_f1: 0.4525
- relation_precision: 0.4225
- relation_recall: 0.4371
- relation_f1: 0.4296
- plantuml_compilation_pass_rate: 0.9000
- llm_element_evaluated: 0.0000
- llm_element_failed: 0.0000
- llm_node_precision: 0.0000
- llm_node_recall: 0.0000
- llm_node_f1: 0.0000
- llm_relation_precision: 0.0000
- llm_relation_recall: 0.0000
- llm_relation_f1: 0.0000