prompt_runs_by_dataset/fsd/2026-06-14__23-04-41__test-fsd/iteration_008/evaluation/analysis_summary.json

{
  "count": 20.0,
  "syntax_pass_rate": 1.0,
  "infrastructure_error_rate": 0.0,
  "node_precision": 0.23036636974136973,
  "node_recall": 0.20854209666322668,
  "node_f1": 0.2189116384110755,
  "relation_precision": 0.22516282568006707,
  "relation_recall": 0.22339292980193504,
  "relation_f1": 0.22427438594384858,
  "plantuml_compilation_pass_rate": 1.0,
  "llm_element_evaluated": 20.0,
  "llm_element_failed": 0.0,
  "llm_node_precision": 0.568875,
  "llm_node_recall": 0.68691,
  "llm_node_f1": 0.58731,
  "llm_relation_precision": 0.46491999999999994,
  "llm_relation_recall": 0.49047,
  "llm_relation_f1": 0.42488000000000004
}

prompt_runs_by_dataset/fsd/2026-06-14__23-04-41__test-fsd/iteration_008/evaluation/analysis_overview.md

## Summary

- count: 20
- syntax_pass_rate: 1.0000
- infrastructure_error_rate: 0.0000
- node_precision: 0.2304
- node_recall: 0.2085
- node_f1: 0.2189
- relation_precision: 0.2252
- relation_recall: 0.2234
- relation_f1: 0.2243
- plantuml_compilation_pass_rate: 1.0000
- llm_element_evaluated: 20.0000
- llm_element_failed: 0.0000
- llm_node_precision: 0.5689
- llm_node_recall: 0.6869
- llm_node_f1: 0.5873
- llm_relation_precision: 0.4649
- llm_relation_recall: 0.4905
- llm_relation_f1: 0.4249