prompt_runs_by_dataset/fsd/2026-06-13__17-50-37__test-fsd/iteration_002/evaluation_summary.json

{
  "count": 10.0,
  "syntax_pass_rate": 1.0,
  "infrastructure_error_rate": 0.0,
  "node_precision": 0.34961607949412826,
  "node_recall": 0.3526927839693797,
  "node_f1": 0.3456847703457873,
  "relation_precision": 0.1915133779264214,
  "relation_recall": 0.17536887664764902,
  "relation_f1": 0.18218466559959828,
  "plantuml_compilation_pass_rate": 1.0,
  "llm_element_evaluated": 0.0,
  "llm_element_failed": 0.0,
  "llm_node_precision": 0.0,
  "llm_node_recall": 0.0,
  "llm_node_f1": 0.0,
  "llm_relation_precision": 0.0,
  "llm_relation_recall": 0.0,
  "llm_relation_f1": 0.0
}

prompt_runs_by_dataset/fsd/2026-06-13__17-50-37__test-fsd/iteration_002/analysis/overview.md

## Summary

- count: 10
- syntax_pass_rate: 1.0000
- infrastructure_error_rate: 0.0000
- node_precision: 0.3496
- node_recall: 0.3527
- node_f1: 0.3457
- relation_precision: 0.1915
- relation_recall: 0.1754
- relation_f1: 0.1822
- plantuml_compilation_pass_rate: 1.0000
- llm_element_evaluated: 0.0000
- llm_element_failed: 0.0000
- llm_node_precision: 0.0000
- llm_node_recall: 0.0000
- llm_node_f1: 0.0000
- llm_relation_precision: 0.0000
- llm_relation_recall: 0.0000
- llm_relation_f1: 0.0000