prompt_runs_by_dataset/us/2026-06-16__12-36-41__test-us/iteration_002/evaluation/analysis_summary.json

{
  "count": 10.0,
  "syntax_pass_rate": 1.0,
  "infrastructure_error_rate": 0.0,
  "node_precision": 0.43018320257164644,
  "node_recall": 0.3909006663626229,
  "node_f1": 0.4096022511355061,
  "relation_precision": 0.39189496591935613,
  "relation_recall": 0.3542401020032599,
  "relation_f1": 0.3721173783946441,
  "plantuml_compilation_pass_rate": 1.0,
  "llm_element_evaluated": 0.0,
  "llm_element_failed": 0.0,
  "llm_node_precision": 0.0,
  "llm_node_recall": 0.0,
  "llm_node_f1": 0.0,
  "llm_relation_precision": 0.0,
  "llm_relation_recall": 0.0,
  "llm_relation_f1": 0.0
}

prompt_runs_by_dataset/us/2026-06-16__12-36-41__test-us/iteration_002/evaluation/analysis_overview.md

## Summary

- count: 10
- syntax_pass_rate: 1.0000
- infrastructure_error_rate: 0.0000
- node_precision: 0.4302
- node_recall: 0.3909
- node_f1: 0.4096
- relation_precision: 0.3919
- relation_recall: 0.3542
- relation_f1: 0.3721
- plantuml_compilation_pass_rate: 1.0000
- llm_element_evaluated: 0.0000
- llm_element_failed: 0.0000
- llm_node_precision: 0.0000
- llm_node_recall: 0.0000
- llm_node_f1: 0.0000
- llm_relation_precision: 0.0000
- llm_relation_recall: 0.0000
- llm_relation_f1: 0.0000