prompt_runs_by_dataset/lmc/2026-06-12__21-04-23__test-lmc/iteration_002/evaluation_summary.json

{
  "count": 10.0,
  "syntax_pass_rate": 1.0,
  "infrastructure_error_rate": 0.0,
  "node_precision": 0.44185714285714284,
  "node_recall": 0.45238871635610767,
  "node_f1": 0.41811951766767547,
  "relation_precision": 0.2167215192713241,
  "relation_recall": 0.18631381868148209,
  "relation_f1": 0.19662784948028808,
  "plantuml_compilation_pass_rate": 1.0,
  "llm_element_evaluated": 0.0,
  "llm_element_failed": 0.0,
  "llm_node_precision": 0.0,
  "llm_node_recall": 0.0,
  "llm_node_f1": 0.0,
  "llm_relation_precision": 0.0,
  "llm_relation_recall": 0.0,
  "llm_relation_f1": 0.0
}

prompt_runs_by_dataset/lmc/2026-06-12__21-04-23__test-lmc/iteration_002/analysis/overview.md

## Summary

- count: 10
- syntax_pass_rate: 1.0000
- infrastructure_error_rate: 0.0000
- node_precision: 0.4419
- node_recall: 0.4524
- node_f1: 0.4181
- relation_precision: 0.2167
- relation_recall: 0.1863
- relation_f1: 0.1966
- plantuml_compilation_pass_rate: 1.0000
- llm_element_evaluated: 0.0000
- llm_element_failed: 0.0000
- llm_node_precision: 0.0000
- llm_node_recall: 0.0000
- llm_node_f1: 0.0000
- llm_relation_precision: 0.0000
- llm_relation_recall: 0.0000
- llm_relation_f1: 0.0000