prompt_runs_by_dataset/fsd/2026-06-14__23-04-41__test-fsd/iteration_003/evaluation/analysis_summary.json

{
  "count": 20.0,
  "syntax_pass_rate": 1.0,
  "infrastructure_error_rate": 0.0,
  "node_precision": 0.3340497234247234,
  "node_recall": 0.37744524663932555,
  "node_f1": 0.3544240944851458,
  "relation_precision": 0.2592557714616538,
  "relation_recall": 0.28810979120235786,
  "relation_f1": 0.2729222708870803,
  "plantuml_compilation_pass_rate": 1.0,
  "llm_element_evaluated": 20.0,
  "llm_element_failed": 0.0,
  "llm_node_precision": 0.62953,
  "llm_node_recall": 0.7900349999999999,
  "llm_node_f1": 0.676015,
  "llm_relation_precision": 0.445985,
  "llm_relation_recall": 0.5206000000000001,
  "llm_relation_f1": 0.4274
}

prompt_runs_by_dataset/fsd/2026-06-14__23-04-41__test-fsd/iteration_003/evaluation/analysis_overview.md

## Summary

- count: 20
- syntax_pass_rate: 1.0000
- infrastructure_error_rate: 0.0000
- node_precision: 0.3340
- node_recall: 0.3774
- node_f1: 0.3544
- relation_precision: 0.2593
- relation_recall: 0.2881
- relation_f1: 0.2729
- plantuml_compilation_pass_rate: 1.0000
- llm_element_evaluated: 20.0000
- llm_element_failed: 0.0000
- llm_node_precision: 0.6295
- llm_node_recall: 0.7900
- llm_node_f1: 0.6760
- llm_relation_precision: 0.4460
- llm_relation_recall: 0.5206
- llm_relation_f1: 0.4274