prompt_runs_by_dataset/fsd/2026-06-13__14-34-47__test-fsd/iteration_005/evaluation_summary.json

{
  "count": 10.0,
  "syntax_pass_rate": 0.9,
  "infrastructure_error_rate": 0.0,
  "node_precision": 0.36099246595189804,
  "node_recall": 0.3745646084520765,
  "node_f1": 0.36173453996983407,
  "relation_precision": 0.2443452380952381,
  "relation_recall": 0.2771590909090909,
  "relation_f1": 0.25893331668331665,
  "plantuml_compilation_pass_rate": 0.9,
  "llm_element_evaluated": 0.0,
  "llm_element_failed": 0.0,
  "llm_node_precision": 0.0,
  "llm_node_recall": 0.0,
  "llm_node_f1": 0.0,
  "llm_relation_precision": 0.0,
  "llm_relation_recall": 0.0,
  "llm_relation_f1": 0.0
}

prompt_runs_by_dataset/fsd/2026-06-13__14-34-47__test-fsd/iteration_005/analysis/overview.md

## Summary

- count: 10
- syntax_pass_rate: 0.9000
- infrastructure_error_rate: 0.0000
- node_precision: 0.3610
- node_recall: 0.3746
- node_f1: 0.3617
- relation_precision: 0.2443
- relation_recall: 0.2772
- relation_f1: 0.2589
- plantuml_compilation_pass_rate: 0.9000
- llm_element_evaluated: 0.0000
- llm_element_failed: 0.0000
- llm_node_precision: 0.0000
- llm_node_recall: 0.0000
- llm_node_f1: 0.0000
- llm_relation_precision: 0.0000
- llm_relation_recall: 0.0000
- llm_relation_f1: 0.0000