prompt_runs_by_dataset/us/2026-06-16__11-08-11__test-us/iteration_004/evaluation/analysis_summary.json

{
  "count": 10.0,
  "syntax_pass_rate": 0.9,
  "infrastructure_error_rate": 0.0,
  "node_precision": 0.4779904291111188,
  "node_recall": 0.4292151997108894,
  "node_f1": 0.45229163261965316,
  "relation_precision": 0.4302585323173559,
  "relation_recall": 0.3503892635599953,
  "relation_f1": 0.38623812447878497,
  "plantuml_compilation_pass_rate": 0.9,
  "llm_element_evaluated": 0.0,
  "llm_element_failed": 0.0,
  "llm_node_precision": 0.0,
  "llm_node_recall": 0.0,
  "llm_node_f1": 0.0,
  "llm_relation_precision": 0.0,
  "llm_relation_recall": 0.0,
  "llm_relation_f1": 0.0
}

prompt_runs_by_dataset/us/2026-06-16__11-08-11__test-us/iteration_004/evaluation/analysis_overview.md

## Summary

- count: 10
- syntax_pass_rate: 0.9000
- infrastructure_error_rate: 0.0000
- node_precision: 0.4780
- node_recall: 0.4292
- node_f1: 0.4523
- relation_precision: 0.4303
- relation_recall: 0.3504
- relation_f1: 0.3862
- plantuml_compilation_pass_rate: 0.9000
- llm_element_evaluated: 0.0000
- llm_element_failed: 0.0000
- llm_node_precision: 0.0000
- llm_node_recall: 0.0000
- llm_node_f1: 0.0000
- llm_relation_precision: 0.0000
- llm_relation_recall: 0.0000
- llm_relation_f1: 0.0000