prompt_runs_by_dataset/fsd/2026-06-18__23-12-33__test-fsd/iteration_006/evaluation/analysis_summary.json

{
  "count": 20.0,
  "syntax_pass_rate": 1.0,
  "infrastructure_error_rate": 0.0,
  "node_precision": 0.37913947062628606,
  "node_recall": 0.4549335386835387,
  "node_f1": 0.41359271694775407,
  "relation_precision": 0.3617877492877493,
  "relation_recall": 0.49746894409937886,
  "relation_f1": 0.4189159561080785,
  "plantuml_compilation_pass_rate": 1.0,
  "llm_element_evaluated": 20.0,
  "llm_element_failed": 0.0,
  "llm_node_precision": 0.7792,
  "llm_node_recall": 0.7857350000000001,
  "llm_node_f1": 0.762465,
  "llm_relation_precision": 0.55297,
  "llm_relation_recall": 0.5604549999999999,
  "llm_relation_f1": 0.5408000000000001
}

prompt_runs_by_dataset/fsd/2026-06-18__23-12-33__test-fsd/iteration_006/evaluation/analysis_overview.md

## Summary

- count: 20
- syntax_pass_rate: 1.0000
- infrastructure_error_rate: 0.0000
- node_precision: 0.3791
- node_recall: 0.4549
- node_f1: 0.4136
- relation_precision: 0.3618
- relation_recall: 0.4975
- relation_f1: 0.4189
- plantuml_compilation_pass_rate: 1.0000
- llm_element_evaluated: 20.0000
- llm_element_failed: 0.0000
- llm_node_precision: 0.7792
- llm_node_recall: 0.7857
- llm_node_f1: 0.7625
- llm_relation_precision: 0.5530
- llm_relation_recall: 0.5605
- llm_relation_f1: 0.5408