prompt_runs_by_dataset/fsd/2026-06-12__20-25-46__test-fsd/iteration_003/evaluation_summary.json

{
  "count": 10.0,
  "syntax_pass_rate": 1.0,
  "infrastructure_error_rate": 0.0,
  "node_precision": 0.3072239507058683,
  "node_recall": 0.3238867355727821,
  "node_f1": 0.30752063610674274,
  "relation_precision": 0.11997785160575858,
  "relation_recall": 0.11702865761689292,
  "relation_f1": 0.11689544369194482,
  "plantuml_compilation_pass_rate": 1.0,
  "llm_element_evaluated": 0.0,
  "llm_element_failed": 0.0,
  "llm_node_precision": 0.0,
  "llm_node_recall": 0.0,
  "llm_node_f1": 0.0,
  "llm_relation_precision": 0.0,
  "llm_relation_recall": 0.0,
  "llm_relation_f1": 0.0
}

prompt_runs_by_dataset/fsd/2026-06-12__20-25-46__test-fsd/iteration_003/analysis/overview.md

## Summary

- count: 10
- syntax_pass_rate: 1.0000
- infrastructure_error_rate: 0.0000
- node_precision: 0.3072
- node_recall: 0.3239
- node_f1: 0.3075
- relation_precision: 0.1200
- relation_recall: 0.1170
- relation_f1: 0.1169
- plantuml_compilation_pass_rate: 1.0000
- llm_element_evaluated: 0.0000
- llm_element_failed: 0.0000
- llm_node_precision: 0.0000
- llm_node_recall: 0.0000
- llm_node_f1: 0.0000
- llm_relation_precision: 0.0000
- llm_relation_recall: 0.0000
- llm_relation_f1: 0.0000